{
  "name": "codebase-documentor-for-aws",
  "version": "1.0.0",
  "description": "Analyze codebases to generate structured technical documentation with source-of-truth citations. Optimized for AWS workloads using CDK, CloudFormation, and Terraform.",
  "author": {
    "name": "Amazon Web Services",
    "email": "aws-agent-plugins@amazon.com",
    "url": "https://github.com/awslabs/agent-plugins"
  },
  "homepage": "https://github.com/awslabs/agent-plugins",
  "repository": "https://github.com/awslabs/agent-plugins",
  "license": "Apache-2.0",
  "keywords": [
    "aws",
    "aws agent skills",
    "documentation",
    "architecture",
    "diagram",
    "draw.io",
    "codebase-analysis",
    "cdk",
    "cloudformation",
    "terraform",
    "onboarding"
  ],
  "skills": "./skills/",
  "mcpServers": "./.mcp.json",
  "interface": {
    "displayName": "Codebase Documentor for AWS",
    "shortDescription": "Analyze codebases and generate structured technical documentation with citations.",
    "longDescription": "Analyze AWS-deployed services and codebases to generate structured technical documentation with source-of-truth citations linking every finding back to code.",
    "defaultPrompt": [
      "Analyze this codebase and generate documentation.",
      "I inherited this code — help me understand and document it.",
      "Document the architecture and components of this service."
    ],
    "developerName": "Amazon Web Services",
    "category": "Development",
    "capabilities": [
      "Read",
      "Write"
    ],
    "websiteURL": "https://github.com/awslabs/agent-plugins",
    "privacyPolicyURL": "https://aws.amazon.com/privacy/",
    "termsOfServiceURL": "https://aws.amazon.com/service-terms/",
    "brandColor": "#FF9900"
  }
}
