{
  "name": "sagemaker-ai",
  "version": "1.0.0",
  "description": "Build, train, and deploy AI models with deep AWS AI/ML expertise brought directly into your coding assistants, covering the surface area of Amazon SageMaker AI.",
  "author": {
    "name": "Amazon Web Services",
    "email": "aws-agent-plugins@amazon.com",
    "url": "https://github.com/awslabs/agent-plugins"
  },
  "homepage": "https://github.com/awslabs/agent-plugins",
  "repository": "https://github.com/awslabs/agent-plugins",
  "license": "Apache-2.0",
  "keywords": [
    "sagemaker",
    "machine-learning",
    "generative-ai",
    "fine-tuning",
    "training",
    "deployment",
    "inference",
    "mlops",
    "aws"
  ],
  "skills": "./skills/",
  "mcpServers": "./.mcp.json",
  "interface": {
    "displayName": "SageMaker AI",
    "shortDescription": "Build, tune, evaluate, and deploy AI workloads on SageMaker AI.",
    "longDescription": "Amazon SageMaker AI workflows for planning, fine-tuning, evaluation, deployment, and HyperPod operations.",
    "defaultPrompt": [
      "Plan a SageMaker AI workflow for this project.",
      "Help me fine-tune and deploy a model on AWS.",
      "Review this ML setup for SageMaker best practices."
    ],
    "developerName": "Amazon Web Services",
    "category": "AI",
    "capabilities": [
      "Read",
      "Write"
    ],
    "websiteURL": "https://github.com/awslabs/agent-plugins",
    "privacyPolicyURL": "https://aws.amazon.com/privacy/",
    "termsOfServiceURL": "https://aws.amazon.com/service-terms/",
    "brandColor": "#FF9900"
  }
}
