{
  "name": "aws-serverless",
  "version": "1.0.0",
  "description": "Design, build, deploy, test, and debug serverless applications with AWS Serverless services.",
  "author": {
    "name": "Amazon Web Services",
    "email": "aws-agent-plugins@amazon.com",
    "url": "https://github.com/awslabs/agent-plugins"
  },
  "homepage": "https://github.com/awslabs/agent-plugins",
  "repository": "https://github.com/awslabs/agent-plugins",
  "license": "Apache-2.0",
  "keywords": [
    "aws",
    "lambda",
    "durable functions",
    "serverless",
    "development",
    "sam",
    "api-gateway",
    "eventbridge",
    "step-functions"
  ],
  "skills": "./skills/",
  "mcpServers": "./.mcp.json",
  "interface": {
    "displayName": "AWS Serverless",
    "shortDescription": "Build Lambda, API Gateway, Step Functions, and SAM or CDK workflows.",
    "longDescription": "AWS serverless expertise for Lambda, API Gateway, durable functions, and deployment workflows with SAM or CDK.",
    "defaultPrompt": [
      "Add a Lambda-backed AWS feature to this app.",
      "Generate CDK for a serverless workflow.",
      "Review this repo for AWS serverless best practices."
    ],
    "developerName": "Amazon Web Services",
    "category": "Development",
    "capabilities": [
      "Read",
      "Write"
    ],
    "websiteURL": "https://github.com/awslabs/agent-plugins",
    "privacyPolicyURL": "https://aws.amazon.com/privacy/",
    "termsOfServiceURL": "https://aws.amazon.com/service-terms/",
    "brandColor": "#FF9900"
  }
}
