{
  "name": "databases-on-aws",
  "version": "1.0.0",
  "description": "Expert database guidance for the AWS database portfolio. Design schemas, execute queries, handle migrations, and choose the right database for your workload.",
  "author": {
    "name": "Amazon Web Services",
    "email": "aws-agent-plugins@amazon.com",
    "url": "https://github.com/awslabs/agent-plugins"
  },
  "homepage": "https://github.com/awslabs/agent-plugins",
  "repository": "https://github.com/awslabs/agent-plugins",
  "license": "Apache-2.0",
  "keywords": [
    "aws",
    "aurora",
    "database",
    "databases",
    "distributed-sql",
    "dsql",
    "iam-auth",
    "migration",
    "postgresql",
    "postgres",
    "schema",
    "serverless",
    "sql"
  ],
  "skills": "./skills/",
  "mcpServers": "./.mcp.json",
  "interface": {
    "displayName": "Databases on AWS",
    "shortDescription": "Design schemas, query data, and choose the right AWS database path.",
    "longDescription": "AWS database guidance for schema design, queries, migrations, and database selection, starting with Aurora DSQL workflows.",
    "defaultPrompt": [
      "Review this schema for Aurora DSQL fit.",
      "Plan a migration path to AWS databases.",
      "Help me use Aurora DSQL safely in this repo."
    ],
    "developerName": "Amazon Web Services",
    "category": "Database",
    "capabilities": [
      "Read",
      "Write"
    ],
    "websiteURL": "https://github.com/awslabs/agent-plugins",
    "privacyPolicyURL": "https://aws.amazon.com/privacy/",
    "termsOfServiceURL": "https://aws.amazon.com/service-terms/",
    "brandColor": "#FF9900"
  },
  "hooks": "./hooks/hooks.json"
}
