{
  "name": "deploy-on-aws",
  "version": "1.1.0",
  "description": "Deploy applications to AWS with architecture recommendations, cost estimates, and IaC deployment.",
  "author": {
    "name": "Amazon Web Services",
    "email": "aws-agent-plugins@amazon.com",
    "url": "https://github.com/awslabs/agent-plugins"
  },
  "homepage": "https://github.com/awslabs/agent-plugins",
  "repository": "https://github.com/awslabs/agent-plugins",
  "license": "Apache-2.0",
  "keywords": [
    "aws",
    "deploy",
    "infrastructure",
    "cdk",
    "cloudformation",
    "pricing"
  ],
  "skills": "./skills/",
  "mcpServers": "./.mcp.json",
  "interface": {
    "displayName": "Deploy on AWS",
    "shortDescription": "Pick AWS services, estimate cost, and generate infrastructure.",
    "longDescription": "Deployment guidance that recommends AWS architectures, estimates costs, and generates infrastructure as code.",
    "defaultPrompt": [
      "Recommend an AWS architecture for this repo.",
      "Estimate monthly AWS cost before generating IaC.",
      "Generate CDK to deploy this app on AWS."
    ],
    "developerName": "Amazon Web Services",
    "category": "Deployment",
    "capabilities": [
      "Read",
      "Write"
    ],
    "websiteURL": "https://github.com/awslabs/agent-plugins",
    "privacyPolicyURL": "https://aws.amazon.com/privacy/",
    "termsOfServiceURL": "https://aws.amazon.com/service-terms/",
    "brandColor": "#FF9900"
  }
}
