{
  "name": "amazon-location-service",
  "version": "1.0.0",
  "description": "Guide developers through adding maps, places search, geocoding, routing, and other geospatial features with Amazon Location Service, including authentication setup, SDK integration, and best practices.",
  "author": {
    "name": "Amazon Web Services",
    "email": "aws-agent-plugins@amazon.com",
    "url": "https://github.com/awslabs/agent-plugins"
  },
  "homepage": "https://github.com/awslabs/agent-plugins",
  "repository": "https://github.com/awslabs/agent-plugins",
  "license": "Apache-2.0",
  "keywords": [
    "location",
    "maps",
    "geocoding",
    "routing",
    "places",
    "geofencing",
    "tracking",
    "amazon-location",
    "maplibre",
    "address",
    "coordinates"
  ],
  "skills": "./skills/",
  "mcpServers": "./.mcp.json",
  "interface": {
    "displayName": "Amazon Location Service",
    "shortDescription": "Build maps, routing, geocoding, and places workflows on AWS.",
    "longDescription": "Guided AWS expertise for maps, routing, geocoding, and places features built with Amazon Location Service.",
    "defaultPrompt": [
      "Add Amazon Location Service to this app.",
      "Plan a geocoding and places search workflow.",
      "Review this map integration for AWS best practices."
    ],
    "developerName": "Amazon Web Services",
    "category": "Location",
    "capabilities": [
      "Read",
      "Write"
    ],
    "websiteURL": "https://github.com/awslabs/agent-plugins",
    "privacyPolicyURL": "https://aws.amazon.com/privacy/",
    "termsOfServiceURL": "https://aws.amazon.com/service-terms/",
    "brandColor": "#FF9900"
  }
}
